{
  "schemaVersion": 2,
  "id": "case-999-schema-fixture",
  "title": "数字の根拠を選ぶ",
  "subtitle": "ケーススキーマv2の最小検証教材",
  "metadata": {
    "contentVersion": "1.0.0",
    "status": "tested",
    "releaseOrder": 999,
    "difficulty": {
      "level": 1,
      "label": "入門"
    },
    "estimatedMinutes": 5,
    "format": "micro-case",
    "industry": "general-business",
    "companyStage": "established",
    "fictional": true,
    "locale": "ja-JP",
    "publishedAt": null,
    "reviewedAt": null
  },
  "pedagogy": {
    "learningObjectives": [
      "問いに直接関係する根拠を選べる"
    ],
    "prerequisiteSkillIds": [],
    "skillIds": [
      "reasoning.evidence-selection"
    ],
    "accountingTopics": [],
    "analysisMethods": [
      "根拠選択"
    ],
    "recommendedModes": [
      "beginner",
      "standard"
    ],
    "reviewStrategy": {
      "type": "spaced-retrieval",
      "intervalsDays": [
        1,
        3,
        7
      ]
    }
  },
  "documents": [
    {
      "id": "fixture-note",
      "type": "interview",
      "title": "担当者メモ",
      "speaker": "担当者",
      "entries": [
        {
          "question": "売上は増えましたか。",
          "answer": "売上は増えましたが、入金は翌月です。"
        }
      ]
    }
  ],
  "pages": [
    {
      "id": "page-01-briefing",
      "order": 1,
      "type": "story",
      "title": "案件受領",
      "unlock": {
        "type": "always"
      },
      "estimatedMinutes": 1,
      "skillIds": [],
      "story": [
        "担当者の説明から、最初に確認する事実を選ぶ。"
      ]
    },
    {
      "id": "page-02-question",
      "order": 2,
      "type": "exercise",
      "title": "根拠を選ぶ",
      "unlock": {
        "type": "page-complete",
        "pageId": "page-01-briefing"
      },
      "estimatedMinutes": 2,
      "skillIds": [
        "reasoning.evidence-selection"
      ],
      "documentIds": [
        "fixture-note"
      ],
      "steps": [
        {
          "id": "step-02-01",
          "type": "singleChoice",
          "instruction": "入金時期を確認する根拠を選んでください。",
          "skillIds": [
            "reasoning.evidence-selection"
          ],
          "hints": [
            {
              "level": 1,
              "label": "着眼点",
              "text": "売上の計上時点と入金時点を分けます。"
            },
            {
              "level": 2,
              "label": "考え方",
              "text": "担当者メモに書かれた入金予定を確認します。"
            }
          ],
          "assessment": {
            "mode": "auto",
            "maxPoints": 5,
            "rubricCriteria": []
          },
          "options": [
            {
              "id": "payment-next-month",
              "label": "入金は翌月である"
            },
            {
              "id": "sales-increased",
              "label": "売上は増えた"
            }
          ],
          "correctOptionId": "payment-next-month",
          "scoring": {
            "maxPoints": 5
          },
          "feedback": {
            "payment-next-month": "入金時期を直接示す根拠です。",
            "default": "問いに直接答える記述を選びます。"
          }
        }
      ]
    },
    {
      "id": "page-03-ending",
      "order": 3,
      "type": "ending",
      "title": "根拠から答える",
      "unlock": {
        "type": "page-complete",
        "pageId": "page-02-question"
      },
      "estimatedMinutes": 2,
      "skillIds": [
        "reasoning.evidence-selection"
      ],
      "story": [
        "問いに直接関係する事実を選ぶことで、判断の筋道が明確になった。"
      ],
      "modelAnalysis": {
        "summary": "入金時期を問われた場合は、売上の増減ではなく入金予定を根拠にする。",
        "keyFindings": [
          {
            "title": "問いと根拠を対応させる",
            "evidence": "担当者メモに翌月入金と明記されている。"
          }
        ]
      },
      "review": {
        "rubricId": "rubric-case-999",
        "checklist": [
          "問いに直接答える根拠を選んだ"
        ]
      },
      "resultTiers": [
        {
          "id": "complete",
          "minScore": 0,
          "title": "根拠を確認できました",
          "message": "問いと資料を対応させました。"
        }
      ]
    }
  ],
  "scoring": {
    "maxAutoScore": 5,
    "proposalSelfReviewMax": 0,
    "maxTotalScore": 5,
    "normalizedScoreFormula": "round(autoScore / 5 * 100)",
    "autoScoredStepIds": [
      "step-02-01"
    ],
    "scoreDisplay": "percentage",
    "allowRetry": true
  }
}
